{"session_id": "76d6d2f3-4b7a-46bb-94d8-e19ddeeb0cca", "seq": 0, "rate_hz": 72, "source": "xr_hands", "joints": ["head", "l_wrist", "r_wrist", "l_index_tip", "r_index_tip"], "t_ms": [0.0, 13.9, 27.8, 41.7, 55.6, 69.4, 83.3, 97.2, 111.1, 125.0, 138.9, 152.8, 166.7, 180.6, 194.4, 208.3, 222.2, 236.1, 250.0, 263.9], "frames": {"head": {"pos": [[0.0, 1.2, 0], [0.0005, 1.2, 0], [0.001, 1.2, 0], [0.0015, 1.2, 0], [0.002, 1.2, 0], [0.0025, 1.2, 0], [0.003, 1.2, 0], [0.0035, 1.2, 0], [0.004, 1.2, 0], [0.0045, 1.2, 0], [0.005, 1.2, 0], [0.0055, 1.2, 0], [0.006, 1.2, 0], [0.0065, 1.2, 0], [0.007, 1.2, 0], [0.0075, 1.2, 0], [0.008, 1.2, 0], [0.0085, 1.2, 0], [0.009, 1.2, 0], [0.0095, 1.2, 0]], "rot": [[0, 0, 0, 1], [0, 0, 0, 1], [0, 0, 0, 1], [0, 0, 0, 1], [0, 0, 0, 1], [0, 0, 0, 1], [0, 0, 0, 1], [0, 0, 0, 1], [0, 0, 0, 1], [0, 0, 0, 1], [0, 0, 0, 1], [0, 0, 0, 1], [0, 0, 0, 1], [0, 0, 0, 1], [0, 0, 0, 1], [0, 0, 0, 1], [0, 0, 0, 1], [0, 0, 0, 1], [0, 0, 0, 1], [0, 0, 0, 1]], "conf": [1.0, 1.0, 1.0, 1.0, 1.0, 1.0, 1.0, 1.0, 1.0, 1.0, 1.0, 1.0, 1.0, 1.0, 1.0, 1.0, 1.0, 1.0, 1.0, 1.0]}, "l_wrist": {"pos": [[-0.2, 0.95, 0.3], [-0.1995, 0.95, 0.3], [-0.199, 0.95, 0.3], [-0.1985, 0.95, 0.3], [-0.198, 0.95, 0.3], [-0.1975, 0.95, 0.3], [-0.197, 0.95, 0.3], [-0.1965, 0.95, 0.3], [-0.196, 0.95, 0.3], [-0.1955, 0.95, 0.3], [-0.195, 0.95, 0.3], [-0.1945, 0.95, 0.3], [-0.194, 0.95, 0.3], [-0.1935, 0.95, 0.3], [-0.193, 0.95, 0.3], [-0.1925, 0.95, 0.3], [-0.192, 0.95, 0.3], [-0.1915, 0.95, 0.3], [-0.191, 0.95, 0.3], [-0.1905, 0.95, 0.3]], "rot": [[0, 0, 0, 1], [0, 0, 0, 1], [0, 0, 0, 1], [0, 0, 0, 1], [0, 0, 0, 1], [0, 0, 0, 1], [0, 0, 0, 1], [0, 0, 0, 1], [0, 0, 0, 1], [0, 0, 0, 1], [0, 0, 0, 1], [0, 0, 0, 1], [0, 0, 0, 1], [0, 0, 0, 1], [0, 0, 0, 1], [0, 0, 0, 1], [0, 0, 0, 1], [0, 0, 0, 1], [0, 0, 0, 1], [0, 0, 0, 1]], "conf": [1.0, 1.0, 1.0, 1.0, 1.0, 1.0, 1.0, 1.0, 1.0, 1.0, 1.0, 1.0, 1.0, 1.0, 1.0, 1.0, 1.0, 1.0, 1.0, 1.0]}, "r_wrist": {"pos": [[0.12, 0.95, 0.31], [0.1205, 0.95, 0.31], [0.121, 0.95, 0.31], [0.1215, 0.95, 0.31], [0.122, 0.95, 0.31], [0.1225, 0.95, 0.31], [0.123, 0.95, 0.31], [0.1235, 0.95, 0.31], [0.124, 0.95, 0.31], [0.1245, 0.95, 0.31], [0.125, 0.95, 0.31], [0.1255, 0.95, 0.31], [0.126, 0.95, 0.31], [0.1265, 0.95, 0.31], [0.127, 0.95, 0.31], [0.1275, 0.95, 0.31], [0.128, 0.95, 0.31], [0.1285, 0.95, 0.31], [0.129, 0.95, 0.31], [0.1295, 0.95, 0.31]], "rot": [[0, 0, 0, 1], [0, 0, 0, 1], [0, 0, 0, 1], [0, 0, 0, 1], [0, 0, 0, 1], [0, 0, 0, 1], [0, 0, 0, 1], [0, 0, 0, 1], [0, 0, 0, 1], [0, 0, 0, 1], [0, 0, 0, 1], [0, 0, 0, 1], [0, 0, 0, 1], [0, 0, 0, 1], [0, 0, 0, 1], [0, 0, 0, 1], [0, 0, 0, 1], [0, 0, 0, 1], [0, 0, 0, 1], [0, 0, 0, 1]], "conf": [1.0, 1.0, 1.0, 1.0, 1.0, 1.0, 1.0, 1.0, 1.0, 1.0, 1.0, 1.0, 1.0, 1.0, 1.0, 1.0, 1.0, 1.0, 1.0, 1.0]}, "l_index_tip": {"pos": [[-0.18, 0.97, 0.4], [-0.1795, 0.97, 0.4], [-0.179, 0.97, 0.4], [-0.1785, 0.97, 0.4], [-0.178, 0.97, 0.4], [-0.1775, 0.97, 0.4], [-0.177, 0.97, 0.4], [-0.1765, 0.97, 0.4], [-0.176, 0.97, 0.4], [-0.1755, 0.97, 0.4], [-0.175, 0.97, 0.4], [-0.1745, 0.97, 0.4], [-0.174, 0.97, 0.4], [-0.1735, 0.97, 0.4], [-0.173, 0.97, 0.4], [-0.1725, 0.97, 0.4], [-0.172, 0.97, 0.4], [-0.1715, 0.97, 0.4], [-0.171, 0.97, 0.4], [-0.1705, 0.97, 0.4]], "rot": [[0, 0, 0, 1], [0, 0, 0, 1], [0, 0, 0, 1], [0, 0, 0, 1], [0, 0, 0, 1], [0, 0, 0, 1], [0, 0, 0, 1], [0, 0, 0, 1], [0, 0, 0, 1], [0, 0, 0, 1], [0, 0, 0, 1], [0, 0, 0, 1], [0, 0, 0, 1], [0, 0, 0, 1], [0, 0, 0, 1], [0, 0, 0, 1], [0, 0, 0, 1], [0, 0, 0, 1], [0, 0, 0, 1], [0, 0, 0, 1]], "conf": [1.0, 1.0, 1.0, 1.0, 1.0, 1.0, 1.0, 1.0, 1.0, 1.0, 1.0, 1.0, 1.0, 1.0, 1.0, 1.0, 1.0, 1.0, 1.0, 1.0]}, "r_index_tip": {"pos": [[0.12, 0.96, 0.45], [0.1205, 0.96, 0.45], [0.121, 0.96, 0.45], [0.1215, 0.96, 0.45], [0.122, 0.96, 0.45], [0.1225, 0.96, 0.45], [0.123, 0.96, 0.45], [0.1235, 0.96, 0.45], [0.124, 0.96, 0.45], [0.1245, 0.96, 0.45], [0.125, 0.96, 0.45], [0.1255, 0.96, 0.45], [0.126, 0.96, 0.45], [0.1265, 0.96, 0.45], [0.127, 0.96, 0.45], [0.1275, 0.96, 0.45], [0.128, 0.96, 0.45], [0.1285, 0.96, 0.45], [0.129, 0.96, 0.45], [0.1295, 0.96, 0.45]], "rot": [[0, 0, 0, 1], [0, 0, 0, 1], [0, 0, 0, 1], [0, 0, 0, 1], [0, 0, 0, 1], [0, 0, 0, 1], [0, 0, 0, 1], [0, 0, 0, 1], [0, 0, 0, 1], [0, 0, 0, 1], [0, 0, 0, 1], [0, 0, 0, 1], [0, 0, 0, 1], [0, 0, 0, 1], [0, 0, 0, 1], [0, 0, 0, 1], [0, 0, 0, 1], [0, 0, 0, 1], [0, 0, 0, 1], [0, 0, 0, 1]], "conf": [1.0, 1.0, 1.0, 1.0, 1.0, 1.0, 1.0, 1.0, 1.0, 1.0, 1.0, 1.0, 1.0, 1.0, 1.0, 1.0, 1.0, 1.0, 1.0, 1.0]}}}