{
  "session_id": "550e8400-e29b-41d4-a716-446655440000",
  "seq": 0,
  "rate_hz": 90,
  "source": "xr_hands",
  "joints": ["head", "l_wrist", "r_wrist"],
  "t_ms": [0, 100, 200, 300, 400, 500, 600, 700, 800, 900],
  "frames": {
    "head": {
      "pos": [[0, 1.5, 0], [0, 1.5, 0], [0, 1.5, 0], [0, 1.5, 0], [0, 1.5, 0], [0, 1.5, 0.05], [0.05, 1.5, 0.05], [0.05, 1.5, 0.1], [0.05, 1.5, 0.1], [0.1, 1.5, 0.1]],
      "rot": [[0, 0, 0, 1], [0, 0, 0, 1], [0, 0, 0, 1], [0, 0, 0, 1], [0, 0, 0, 1], [0, 0, 0, 1], [0, 0, 0, 1], [0, 0, 0, 1], [0, 0, 0, 1], [0, 0, 0, 1]],
      "conf": [1.0, 1.0, 1.0, 1.0, 1.0, 1.0, 1.0, 1.0, 1.0, 1.0]
    },
    "l_wrist": {
      "pos": [[-0.4, 0.8, 0.5], [-0.4, 0.8, 0.5], [-0.4, 0.8, 0.5], [-0.39, 0.82, 0.55], [-0.38, 0.84, 0.6], [-0.37, 0.86, 0.65], [-0.36, 0.88, 0.7], [-0.35, 0.9, 0.75], [-0.34, 0.91, 0.78], [-0.33, 0.92, 0.8]],
      "conf": [1.0, 1.0, 1.0, 1.0, 1.0, 1.0, 1.0, 1.0, 1.0, 1.0]
    },
    "r_wrist": {
      "pos": [[0.4, 0.8, 0.5], [0.4, 0.8, 0.5], [0.4, 0.8, 0.5], [0.41, 0.8, 0.55], [0.42, 0.8, 0.6], [0.43, 0.8, 0.65], [0.44, 0.8, 0.7], [0.45, 0.8, 0.75], [0.46, 0.8, 0.78], [0.47, 0.8, 0.8]],
      "conf": [1.0, 1.0, 1.0, 1.0, 1.0, 1.0, 1.0, 1.0, 1.0, 1.0]
    }
  }
}
